{
  "$schema": "http://json-schema.org/draft-07/schema#",
  "$id": "https://modelconfig.dev/config.schema.json",
  "title": "ModelConfig Schema",
  "type": "object",
  "required": ["version", "environments"],
  "properties": {
    "version": { "type": "number" },
    "environments": {
      "type": "object",
      "additionalProperties": {
        "type": "object",
        "required": ["providers", "models"],
        "properties": {
          "providers": {
            "type": "object",
            "additionalProperties": {
              "type": "object",
              "required": ["type"],
              "properties": {
                "type": { "type": "string" },
                "api_key": { "type": "string" },
                "base_url": { "type": "string" }
              },
              "additionalProperties": true
            }
          },
          "models": {
            "type": "object",
            "additionalProperties": {
              "type": "object",
              "required": ["strategy", "candidates"],
              "properties": {
                "strategy": { "type": "string", "enum": ["priority"] },
                "candidates": {
                  "type": "array",
                  "minItems": 1,
                  "items": { "type": "string" }
                }
              },
              "additionalProperties": false
            }
          }
        },
        "additionalProperties": false
      }
    },
    "aliases": {
      "type": "object",
      "additionalProperties": { "type": "string" }
    },
    "capabilities": {
      "type": "object",
      "properties": {
        "sources": {
          "type": "array",
          "items": { "type": "string" }
        },
        "overrides": {
          "type": "object",
          "additionalProperties": {
            "type": "array",
            "items": { "type": "string" }
          }
        }
      },
      "additionalProperties": false
    }
  },
  "additionalProperties": false
}
